,reviews,stars,date
53,✅ Trip Verified |  I flew with hand baggage but security at Dubai was quick. Entered lounge which was a bit small but good and drink offerings sound. Flight on A380 left on time. Few technical issues with IFE which would have been really irritating had it been a day flight. Decent snack and slept well. Arrivals lounge excellent. Would recommend.,8,17th October 2022
54,"Not Verified | London to Cairo. First, on this 5 hour mid morning flight the only complimentary food and drink were a tiny bag of pretzels and a small bottle of water. Even Southwest is more generous. When unable to connect my phone to order food, I hit the FA call button with no response for more than an hour. When the FA came to collect garbage I had to show him the call light and he gruffly asked me what was the matter. He used his phone to place the order.",1,16th October 2022
55,"✅ Trip Verified |  This review is specifically about Maddie, crew member who took care of us. She was attentive, warm, friendly and nothing was too much trouble. Smiling from start to finish. She should be the brand ambassador for BA.",5,15th October 2022
56,"✅ Trip Verified |  5 hours in a cramped single aisle aircraft, no inflight entertainment. In economy there is no free catering other than a bottle of water a packet of crisps and a minimal selection of food items for purchase.",3,14th October 2022
57,"Not Verified |  DFW-LHR. Had an easy transfer at DFW from American Airlines to British Airways heading to London. First ride on an A380 left me with the feeling that this plane type won't ever be my first choice. Was seated upstairs where the cabin space seemed very roomy, but the seats and rows were very cramped. When the passenger in front reclined the back of the seat was 7 inches from my face and I had a real difficult time trying to view the seat back entertainment screen. The seat itself wasn't too bad but I felt squished and locked in. On a plus side, having a window seat gave me this nice storage area by my side. Ground staff were pleasant and cabin crew were really nice. Plenty of beverages offered and multiple water runs were made during the night. Dinner was rubbish as was the morning pre-landing snack. The entertainment system was very responsive and had a pretty good selection of movies, tv, music and games. All in all it was an OK experience and did get me to London on time and our baggage arrived safely, but I'm not sold on the A380. T5 at LHR is another story that will be in a different review. What a mess that place is.",7,6th October 2022
58,✅ Trip Verified |  Check in at Jersey straightforward. There is a small business class lounge at Jersey with reasonable drinks range and some limited food. Flight boarded on time but take off was delayed due to poor visibility at LHR. Captain kept us well informed and we eventually took off 50 mins behind schedule with a 20 minute late arrival at Heathrow. Good service from the cabin crew and a bacon roll and coffee served. Disappointing that the wait for cases at Heathrow T5 was as long as the flight!,8,1st October 2022
59,"✅ Trip Verified |  Check in at LHR T5 was very quick and queue for security short. We used the South Lounge which was supposed to be the quieter at the time, but was very busy and difficult for our group of 3 to get seated together. Flight boarded on time. Whilst this is only a short flight (35 mins) the service of the cabin crew was outstanding. Glass of champagne, Coronation Chicken Salad and a coffee all served with a smile and a little banter. In spite of some of the issues with BA, their cabin crew are usually exceptional and this was no exception. Flight landed on time and bags delivered quite promptly.",9,1st October 2022
60,"✅ Trip Verified | The check-in process was smooth. I got access to the IGA Lounge which was nice, but not as nice has the Turkish Airlines Lounge. On board was what all this flight was about. This was my first time flying Intra-European Business Class, and though I was well prepared, I still found it underwhelming. First, the seat is just a normal economy seat, with the middle seat blocked off. There is no personal IFE, so basically no entertainment for a 3-hour flight. Meal service was very slow, and by the time it reached half of the business class cabin, one of the 2 choices ran out, plus the meal was not as good as the economy meal I got on my Turkish Airlines flight a few days ago. I could see that staff did their best, but since there were 32 business class passengers on a single aisle aircraft with a small galley, there was so much they could do. Also, the 32 passengers shared one single WC, meaning a long line for the bath room, something I have rarely seen in business class. Arrived at LHR, we did not get a contact gate, but the thing was that there was no bus either, and the crew announced that they had no idea when the bus would come. It finally came, of course, and the delay was more on the airport than the airline, but since BA is the main operator at Heathrow T5, such things will affect their reputation.",1,25th September 2022
61,"✅ Trip Verified | This is my first time flying BA's new Club Suite, which, in my opinion, is very good. Flight to the US, including mine, departed from concourse C of Terminal 5 which did not have many shopping or dining options. However, it was quiet so finding seating was quite easy. The highlight is the Club Suite, which is spacious and provides a great deal of privacy. Meal service was slow, and everything was served on one tray, all at once. I think now is the time for them to begin to get back to pre-pandemic standard. At least the food tasted good, which was not something I previously experienced on BA flights, even in First Class.",10,25th September 2022
62,"✅ Trip Verified |  My 7am flight for a conference in June was cancelled with less than 12h notice - without being given any alternative flight or rebook me upon alternative flight. Upon calling customer service, customer service who said she can only get me a flight 2 days later. They did not work with me as I miss 2 days of conference. They asked me to travel to a different airport in Sweden (Stockholm); which I reluctantly agreed to as I was not given any other choice - but I had to pay for that domestic flight myself. Upon reaching the Gothenburg airport on the day of departure, I saw a direct flight to Heathrow, called customer service and was told there is 1 seat available. So I changed to 8.15am from Gothenburg - Heathrow - Jersey. However, at this point BA told me I have to pay a fee of GBP 710 as I “changed my flight a 2nd time”.  I find it a disgrace that BA charge a fee to change a flight that they cancelled, and they were unable to give alternative options to reach my destination in for the conference. BA proposed that I travel to another airport in Sweden at my own expense. I have since contacted BA for the legal compensation I’m entitled to according to UK law, but I got a rejection as they claim I arranged my own travel to my destination. If I have a choice, I will never travel BA again. Such awful customer service and complete lack of understanding of customer needs.",3,24th September 2022
63,"Not Verified |  I would like to thank all the air and cabin crew for having the best experience with a very long journey! I don’t know how you manage to keep smiling. Couldn’t fault anything. Helpful, reassuring, excellent food and I can’t wait to fly again. Thank you and I really appreciated you.",6,23rd September 2022
64,"✅ Trip Verified |  British Airways personnel was just magnificent. My flight into London was delayed, security had long lines, I ran like a madman to find the gate closed but the plane was still there… the lady at the gate worked the computer at 200 miles an hour to allow me to board (the software program was already closed). This while the flight manager, who came towards the gate, urging her to make a decision since the plane was about to loose its take off spot in line. I was sweating from the run, still out of breath while she handed me my passport giving me the green light to board. I bolted again into the plane feeling bad that I did not personally thank her for her magic. I really hope she gets recognized by British Airways for her performance. Thank you for all you do !",7,20th September 2022
65,Not Verified |  Good flight apart from my seat fabric was coming apart on39J and lack of good leg room. Meal was good from Singapore. Should be more snacks on board. My neighbours passenger charger and headphone socket didn’t work.,8,16th September 2022
66,✅ Trip Verified |  Flight was 1 hour late leaving gate. Crew were friendly. Seats comfortable. But the complimentary snack provided was a bag of ready salted crisps.,5,14th September 2022
67,"✅ Trip Verified |  London to Istanbul. British Airways Business Class rows comprise of three seats with the middle seat empty. Front rows about 5-7 are considered as Business Class, with very short leg space.  No pillows, no blanket, horrible inflight service, staff were harassing me. No curtesy for business Class check-in while waiting for flights. ",3,11th September 2022
68,Not Verified | London to Manchester. British Airways is probably the worst air company I have ever flown with they took 2 hours to unload the luggage and the flight was delayed by an hour. The staff were no help and frankly rude.,9,10th September 2022
69,Not Verified |  Flight was cancelled at the last minute due to “weather” despite pretty much all other flights not being affected. Booked onto a flight the next day. Arrived at the airport 2.5 hours ahead T5. Horrendous check-in and security delays meant we almost missed the new flight. The flight was fine once we got on it but the damage was done.,1,7th September 2022
70,"✅ Trip Verified |  After having a few not so good experiences in the past, I feel I have to write a positive review as well where it is deserved. First of all, the improvement in the BA lounge in Gatwick is massive. The buffet was a joy. We flew on a BA flight but operated by Iberia Express. Wonderful staff and the food was exceptional. Whoever brought in this change of food supplier ... congratulations! Also may I add that this time business class was not 11 rows like last time, but 5 rows which was definitely a big improvement and could be felt in a much more attentive service. I am still not clear on luggage being labelled ""priority"". The luggage certainly does not come out first in the destination airports.",10,7th September 2022
71,"Not Verified |  This review is for BA booking system not a flight . Today I clicked wrong date on line, my mistake and expect to pay a fee. I then go to “cancel booking” and click on the option to not receive a voucher, immediately I received a response saying my voucher is on its way. I call them and speak to a gentleman who continuously spoke over me and would not listen to my concerns and eventually I give up and want to book a new flight, obviously at a much higher price but using the voucher I didn’t want. However to my surprise I am unable to use this voucher because they can’t tell me what it is until I receive it at a point in the future that they can’t say when. So they now have my money and I have to re-book at full cost. In the end in order to get me off the phone they hung up.",10,6th September 2022
72,✅ Trip Verified |  Manchester to Seattle via London. I will never fly BA again. They cancelled my return flight from Heathrow back to Manchester and then cancelled the alternative offered. We had to get our son come all the way to London to pick us up and take us to our car in Manchester. The food was terrible and on the return journey as soon as they had finished serving they were round taking our trays so that they could settle down for the night. I will not be flying BA again,4,31st August 2022
73,"✅ Trip Verified |  Our flight in March 2022 from San Francisco to London on 28th March was cancelled with 3 hours’ notice. We found out on the shuttle bus to the airport. We had to stay overnight for the next day flight. We still have not been recompensed for our expenses (filled in on line) and have received no replies on follow-ups. It is the usual 30 min or longer time to wait on customer service picking up. During this trip, we had to re-schedule a return flight (my wife was ill). This should not have been a problem as the flights were re-bookable. We were given a voucher. This voucher was only bookable by phone. When I phoned to rebook, we got the automated voice saying BA were not taking flight bookings by phone. You can see the problem - how do a use a voucher where I must phone and they are not taking phone bookings ? All I have been offered is another voucher. The time to use has passed. It must be great to be a business that can print endless A4 vouchers and not return money paid for services not rendered. We returned home with Aer Lingus with no drama.",5,28th August 2022
74,"Not Verified |  I sat in seat 25C. Our Cabin Crew lady was called Gina and she went above and beyond to keep the customers happy. She greeted us as we boarded with a very cheery smile, she engaged with two families travelling with young children and gave out games and books. Her trolley service was excellent and she took great care in what she was doing. She had time for a quick chat and I think she said she was half German and half Bulgarian, a really lovely young lady who is a credit to British Airways.",1,23rd August 2022
75,"✅ Trip Verified |  Full afternoon flight. Ready to fly on time. Arrived early. Uneventful flight. Good service. Pre dinner drinks. Drink with meal. Coffee, Drinks available at back. AVML meal was tasty. Hard working crew on a full flight. Audio worked well.",2,23rd August 2022
76,"✅ Trip Verified |  I was told I'd require a 48 hr negative covid test for entry into Philippines. Booked my trip via BA.com, with a transfer in Singapore. They delay my transfer to the next day, okay, not too bothered as have my 48 hr negative covid test, but when I try to check in at Changi Airport, the Philippines Airlines check in staff require a 24 hr negative covid test. Had to rush to a different terminal, get tested, wait for the result, rush back to check in ...the gate had closed.  Had to book an extra night in Singapore hotel, book my own flight to Manila, then also the return journey back to London. If one misses one leg of a BA booked flight, the remaining flights get cancelled.  I discovered Oman Air Business Class and better then British Airways, from treating their customers, quality of service, the business class experience.",2,22nd August 2022
77,"✅ Trip Verified |  Having been promised help to find a hotel room after an outgoing flight from Heathrow was running very late and my hotel would be closed, I boarded the plane on this basis. I was subsequently dumped at Barcelona airport at 0038 to sleep the night on the floor. There was no help at there to find a hotel. I have MS and can't walk without help, BA did nothing, their partners Iberia did nothing. At about 3 am some kind people helped me to an more secure area and toilet and got me some sandwiches. I lost my holiday, my hotel booking, and my music course. BA insist it's not their fault it's the hotels for closing. I would not have got on the plane had I known. I found out I could go to arbitration. BA now say they will withdraw the 'offer' of expenses if I do. Their policy of refusing all compensation for what would have been a dreadful experience for any passenger, is bad enough. For someone who is not mobile, it seems to have ditched the specific responsibilities of Duty of Care and towards Disabled Passengers. So for people with disabilities it's just not worth the risk of travelling with BA.",5,21st August 2022
78,"✅ Trip Verified |  I am a business class customer. British Airways cancelled my return flight and chose an alternative flight with 3 stops. After I complained, they changed the date. When I told them the date would not work, they attempted to charge me additional $5,000 for the change. I submitted a complaint and have not heard anything.  If you try to reach out, no chance.",7,20th August 2022
79,"✅ Trip Verified |  Barbara Collins was super helpful. My boyfriend & I booked flights separately thinking we were on the same one but we found out at check in that he was on separate, slightly later one. Barbara was able to make some changes to ensure we flew together & even managed to put us sitting together! Much appreciate BA! We had a terrific flight over. Food, drinks & nibbles were great & staff were so friendly. Looking forward to returning home with BA.",1,15th August 2022
80,"Not Verified |  My husband, parents who are in their 80’s and I were traveling back to NY from Naples, Italy and had a stopover at Heathrow, London. Let me just say we were not happy when we arrived late to London and missed our connecting flight back to NY. The reason writing this review is the great customer service that Kashmir Dhami gave us. She was very helpful in booking all four of us on the same flight the very next day, which was very hard to do because we all had different bookings so it just made it all so difficult, but she got it done! She is so kind and is amazing at her job.",4,10th August 2022
81,"Not Verified |  On our recommendation my son and his young family (child 4 and baby 9 months) and wife, flew BA to the USA from Cape Town, leaving yesterday evening. Just got off the call with him, after their arrival at Heathrow. Shocked at what he told us re the cabin service provided (or not!!) especially as my wife and I have used them many times a year for + 20 years of business flights from RSA, this our recommendation to him to use them for his holiday. My grandson had a coughing fit, so they asked (bell push) 4 times for glass of water - all ignored. Last one was told ""wait till drinks are served!"" Then when evening meal served - no food available for the 4 year old, which was pre-ordered online, they said nothing available and when my son explained it had been pre-ordered - the cabin staff supervisors response - ""prove it Sir"", that sealed it for us, if that’s the BA response to what’s seen as cattle class - it will permeate to our normal travel class, so our next booking will be an alternate.",1,4th August 2022
82,"Not Verified |  We had a nice flight. pushed-off exactly on time. Cabin crew very efficient in all things; friendly for the most part as well. Dinner (hot!) and complimentary wine served in premium economy very good. Do avoid middle seats though, even in premium economy. Only issue was with indifferent/non-helpful BA call center who refused to honor one world status to select seat choice in advance. Nice start to a 3 week trip to England.",10,31st July 2022
83,"✅ Trip Verified |  Holidays ruined, 2 suitcases lost in 2 flights I travelled from London Heathrow to Amsterdam with my brother, before boarding we were told we couldn't take our cabin suitcases with us in the cabin, so they sent them to the cargo. At our arrival in Amsterdam, one of the suitcases was missing, left at London Heathrow, so we had to fill in a report in Amsterdam, this was 3 days ago and we still don't have the suitcase or any information about it. Today I travelled from Amsterdam to London City Airport, again they didn't allow me to board with my cabin suitcase, and when I arrived in London, the suitcase was missing, left in Amsterdam. 2 Suitcases, 2 different flights, they've ruined my holidays. No compensation, no dates on when will I get my property back, no information, lies and more lies.  I was told I could complain online and buy all the things I need, shoes, toiletries, clothes, and I might receive the money back in 30 days! Yes, I might.",9,30th July 2022
84,✅ Trip Verified | Despite BA's promise to credit double tier points for a holiday booked on their website I have received no additional points and my four email communications (including to the Chief Executive) have remained unanswered. Do not be taken in by this marketing con - they just want you to book a holiday and then do not follow up on their promises. Some things just do not change at BA.,1,27th July 2022
85,"✅ Trip Verified |  Refund process is non responsive I have been following up on my refund since October, 2021 which is 9 months now. I have contacted the customer service deck and sent mails to [email protected] several times and all they tell me is it’s been processed. British Airways customer service is bad and needs to be worked on. Till today I have not received my refund. I am just wondering what is happening!",1,27th July 2022
86,"✅ Trip Verified |  Customer service is non-existent. For over a week customer service number message said to call back in a couple weeks. Nothing we needed to accomplish could be done on BA.com I was flying to Nairobi to bring my sister back after her husband died suddenly, My sister and husband had tickets on the July 18 from Nairobi to JFK. When BA received the death certificate, they cancelled my sister's ticket, not once but twice. It took almost 5 weeks to correct this incompetence. My niece and my wife were on the phone for hours plus hold times. 8 times we were told by the web help number we would get a return call and no one ever called back. The ticket was in premium economy. When I tried to upgrade to be with my broken- hearted sister, the price was $4029.00 plus a $25.00 service fee. Where is the efficiency? Where is the empathy? Where is the decency? In addition to the stress of losing her husband, my sister had to go through totally unnecessary stress of not having a ticket until 7 days before her flight. Also when I made my reservation, i was given a price and within 10 seconds was told there was a $1400.00 increase. British Airways has taken a nosedive in my opinion. Words simply don't convey my very deep frustration and disappointment with the company",1,27th July 2022
87,"✅ Trip Verified |  Flight on A380 SFO to LHR. Smooth check in at San Francisco. Airport quiet and efficient. Dedicated BA lounge, excellent food and beverage options and attentive staff. Lounge was very crowded though. Minor departure delay and onto A380 upper deck. I prefer the club world cabin on the upper deck as it is very much quieter. Old style product but clean and well maintained. Staff offered a good level of service and reasonable meals. On time arrival, baggage quite slow. A good flight overall.",10,23rd July 2022
88,"✅ Trip Verified |  For this 5 hour 15 min flight, you are given a bag of potato chips, and a bottle of water. If you want to purchase more food and drink you do this via their app on your phone. Or like me you can pre-order weeks before you fly. However there is no guarantee you will get your order, mine never came, so after enquiring where the order was, they told me they had food for someone who was not on the plane, that someone was me it turned out. They also managed to lose my luggage.  I am still waiting for them to contact me regarding it. I will never use them again.",5,22nd July 2022
89,"✅ Trip Verified |  My wife and I booked a flight in April 2022 that included a return trip from Edinburgh thru London to Washington. When we checked in at Edinburgh Airport 3 hours ahead of time we were informed there were no more seats available on our scheduled flight. We asked how this was possible and were simply told that others had checked in on-line (which we hadn’t done).  We were instructed to come back in 2 hrs and 15 mins, still with our luggage unchecked and not yet going thru security, to see if we could get on the flight via standby. We waited and then finally at 1:15 PM, 45 mins before our scheduled 2:00 PM flight, we were told we could be on the flight and were given boarding passes for the flight to London but no boarding passes for the connecting flight (1:55 mins after arrival time). Our luggage was not checked thru to Washington but only to London. We were told we’d get thru security on time to make the flight and it was suggested that staff would assist us. When we got to Security Check area the line was massively long. We questioned a BA staff member who said we had to get in line like the others. We decided to pay (12 pounds) to go through “Fast Track” Security to make our Flight. We got to the gate in time. Yet, due to a delayed departure caused in part by luggage-space issues on the plane, our flight arrived in London 45 mns late, and after going to the “flight connections” we were told 25 mins before the scheduled departure, with a vague explanation of “there isn’t enough time,” that we could not be given a boarding pass for our flight. We were then directed to baggage claim to retrieve our luggage and then proceed to the check-in area to be rebooked for a later flight. When we got to the check-in counter area a BA staff person, standing at entrance to the check-in line, advised us we should try to call our travel agency to rebook because the line for checking in had not hardly moved in 3 hrs. When we finally got thru on the phone, we were informed that the best BA could do for us was to get us on a flight 5 days later, and then not to our original destination (IAD), but to Baltimore. I was not told or assured I’d be compensated for this extreme expense of staying 5 more days in a hotel - just that I could go to the BA website and make a claim on-line. This ugly experience, still ongoing, has ruined our trip to the UK. ",10,22nd July 2022
