,reviews,stars,date
0,"✅ Trip Verified |  Flew ATL to LHR 8th Jan 2023. Was unlucky enough to be on board a 23 year old 777. Refit gave it a decent IFE screen and the seat looked decent. Although combine the IFE with the cheap and nasty earbuds, and any movie can be ruined. Headrest was great, just a pity little padding is used on the seat as my Wife and I were very uncomfortable. The leg room in general is poor, especially when passengers keep their seat reclined from start to finish. Zero room. Aircraft was tired. Rubber spacers falling out, silicone sealer falling apart in the toilets. Toilet seats old, stained. Rubber on arm rest was hanging off. No post take off drinks/snacks offered.  Meal was sent out after a couple of hours. Was poor. Chicken cubes that reminded me of dog food, mashed potatoes that were purified within an inch of their life. Stale rock hard roll, salad which was rice and carrots?! Dried crackers with no cheese. Kids meal was just as sad. Tiny leaf salad with enough dressing to refloat a shipwreck. Coffee creamer was given with the kids meal? Snack was decent for the adults, bagel with cheese and egg. Hot and tasty. Kids snack was a green wrap with spinach and onions in it.  Very very poor. Mix the food, BA service with a grunt, being crammed into a seat for 7 hours, landing at a remote stand and enduring a bus to the terminal and BA in my opinion, is terrible. This flight was so disappointing. Other than one great member of cabin crew, everything else was just average.",5,9th January 2023
1,"Not Verified |  Great thing about British Airways A380 is the economy section upstairs. Get this if you can as it allows you to have small stowage cupboards at the window seats. Despite being not very old, the A380 looked tired inside. Broken side stowage, a seat that reclined uncontrollably and slow to react IFE. The food was supposed to be Christmas dinner. 3 wafer thin bits of dry turkey, 4 over cooked sprouts and some cubed potatoes. Poor in taste and quality. Mousse desert was great though. Slight issue during the snack meal. Ordered a childs option which was marked as such. Regular meal arrived as well and they were exactly the same. Asked a crew member to be told the difference was the sticker on the box. Staff were ok. Couple decent but mostly just ok. Overall, BA just seems a tad cheap these days. Great to sit upstairs but that was where the enjoyment ended. Just seemed a bit dull and like BA are just an average airline.
",4,8th January 2023
2,"Not Verified | The staff are friendly. The plane was cold, we were shivering, they gave light blankets but they were not enough. Meals were basic. Entertainment was basic. Luggage is delayed, today is day 6 and BA staff over the phone say ""call after 72 hours"". Tracking system is very vague, had to extract information from staff that they arrived to Vancouver on Jan 2nd. I offered to collect baggage but very vague answer ""call the Airport"", asked her for BA phone number at YVR but she said ""we don't have a phone number for you to call, call the main Airport"". Their policy states you can make a claim only after 21 days.",5,6th January 2023
3,"✅ Trip Verified | Probably the worst business class experience I've ever had on an airline. Just a few of the issues: Required to purchase seats on international (Club World) business class. This was not made known during the ticket purchase process and cost me an additional $600 on a single leg (LHR-LAX) for a family of four. Given the very strange business class seating layout on BA A380s, leaving the seat selection to change could have been disastrous for my family. Ridiculously long boarding times on even small aircraft. On my VIE-LHR leg, the boarding time for the A320 was over 50 minutes long, leading to a delayed departure. There was no urgency on the part of staff to speed up the boarding times. Severe overcrowding in the boarding area in satellite C of terminal 5 at Heathrow. Boarding staff would not allow passengers to enter the roped off queue area before boarding (I have no idea why not) and so crowding was extreme. The overall boarding area was far too small for an A380, and I believe this satellite was designed and built after the first A380s were delivered. Online check-in in advance of flights appears to be completely broken. I was urged repeatedly (on the BA website, and via email and text) to ""upload my COVID documents"" even though, at the end of 2022, there are no COVID documents required for travel. After I filled in basic contact information on the website - and did not upload any ""COVID documentation"" - I was informed (several hours later) that my ""COVID documents have been verified"". I then received another text message urging me to ""upload my COVID documentation"". On the VIE-LHR leg, the shop.ba.com page that one is directed to after attempting to connect to wifi on the plane indicated ridiculously incorrect remaining flight times - over six hours, and then four hours just before landing. BA lounges for Club Europe and Club World at Heathrow are often seriously overcrowded. Furniture and carpeting and other finishes in the clubs are worn or dirty. That said, the food in the lounges was of pretty good quality. The food quality in BA lounges at Heathrow may be the only redeeming thing about this airline. Onboard, food and beverage service was far below average for international business class. Terrible, one might say. On the LHR-LAX leg, there was no pre-meal beverage service and there were NO mid-flight beverage services at all. Unlike most business class offerings on other airlines, there was no taking a meal order by flight attendants at the beginning of the flight. Meals were brought out haphazardly shortly after take off, with the ""chicken or fish?"" type of meal selection similar to economy class. There was no coffee or tea service after meals. Food quality was poor, with the pre-landing snack of a ""ploughman's lunch"" being downright disgusting. . There was no beverage or bar set-up in the galley areas - beverages available to passengers during the flight - as is standard on most international business class offerings. Even bottles of water seemed be hidden away, requiring one to ask the flight attendants for water. I won't comment on the bizarre seating layout on the A380, as others have rightly panned the awkwardness and extremely poor design of the seating. The seats are not 6' 2"" long as stated on the BA website, and I found the seats too short for my 6' 2"" height. The ""Priority"" luggage tags were not followed in the baggage delivery.",1,2nd January 2023
4,"✅ Trip Verified | Definitely not recommended, especially for business class. The seats are ridiculous and small, the food is mediocre if that, and good luck with the internet even if you pay for full internet for the entire flight. The service however has been great. My attendant saved me from crying. I don’t know who designed this aircraft but in this expensive business class, in order to move out of you middle seat to go to the bathroom you must rudely climb over the person’s legs sitting in the aisle seat. Your seat is like an enclosed tiny cubicle with no storage space. I’ve unfortunately traveled British Airways business class at least 4 times within the last 4 months. Never again unless there is no other choice. By the way, the business class lounge south at Heathrow is a cattle pen.",1,2nd January 2023
5,"✅ Trip Verified |  BA shuttle service across the UK is still surprisingly a good product. When compared with BA long haul that doesn’t always get the best of comments at times. It’s reasonable priced, works well, fresh crews and no queues or long distances to walk. I don’t know why they still offer a COVID style bottle of water and snack when just stretching to a cup of tea and snack would be great add on for this service. Currently they have an on line sky cafe but it’s too fiddly to work or get connected in short trips.",2,2nd January 2023
6,"✅ Trip Verified | I must admit like many others I tend to avoid BA long haul where possible due to the many poor reviews. But had my first ride on a BA A380 the other day so it was an exception. What can I say. Aircraft immaculate and economy seat really comfortable but that’s about it. IFE didn’t work but wasn’t that interesting anyway. I got the map screenshot for a while. Lunch was poor quality but plenty of nice white wine and other alcoholic drinks made up for it. Cabin crew pleasant but poor grooming lets them down. Some skirts, some trouser suits, some long sleeves some short. Some jackets some waistcoat. Some cardigans on at time and all in all they could have done better I think. Baggage delivery was really quick. Summing up well I am still not coming back to BA not yet. Maybe the old charm will return soon.",8,1st January 2023
7,"Not Verified |  When will BA update their Business class cabin - 8 across on a 777. It is not so much travelling facing backwards as it were, but the cabin staff having to pass food trays across the front of passengers paying business class fares! As for having to pay to reserve a specific seat - an antiquated idea. The cabin staff were fine, food acceptable, check-in OK and Business lounge (breakfast) acceptable. The lack of space in the seating area, small screen and disfunctional entertainment equipment disappointing. Having to step over the reclining passengers feet is not attractive. ",6,30th December 2022
8,✅ Trip Verified |  Paid £200 day before flight for an upgrade from economy to premium economy. At checkin they could not find my booking so a little wait while they rang someone who explains on the upgrade you get deleted from the system the checkin agent sees? Took about 5 minutes to resolve. Seat was nice enough. Stowage pocket in front a bit small. Food was reasonably nice. Shame that the bathroom is all the way back through economy and there is a bit of a queue. IFE system is good but selection mediocre. Worst part of the flight is that at CPT so we were on a remote stand and bussed in. Through passport control quickly but then it took an absolute age to get our luggage which ruined what would otherwise have been a reasonable flight. Upgrade was worth it at £200 maybe £300 (its a long flight) but their offers of £2000 or whatever for premium economy is comedy pricing. Score before the luggage fiasco would have been 7 or 8 / 10. With the luggage fiasco I can't rate it more than 4/10.,4,29th December 2022
9,"✅ Trip Verified |  BA website did not work (weirdly deleted my flight from ""upcoming flights"" on the day of departure). Chaos at Cape Town airport with hundreds queuing as the computers were down. Chaos at the gate / no queue management for premium passengers. Very nice new A350 with smart new club suite. Champagne warm (cabin crew said its impossible to serve it cold, which is not true as Air France manage it). Disappointing meal, wine served so late after the food you have finished by the time it arrives. Cheese ice cold and tasteless (why can't the champagne / white wine be in the fridge used for the cheese?). Good IFE system but mediocre film selection. Disappointing breakfast. Overall: 3 / 10. Flew Air France business the month before which was way better. So sad what's become of BA.",4,29th December 2022
10,"✅ Trip Verified |  Absolutely terrible experience with British Airways. After a short flight from London Heathrow to Frankfurt, they couldn't get my suitcase to me in time for my next flight (on Cathay Pacific) to Melbourne, despite a 3 hour gap between the two flights. Told me they would arrange for the suitcase to be transferred directly to Melbourne - instead, it got to Hong Kong and left there. When they finally tracked it down, they sent it back to London. All happened over Christmas, so very stressful yet minimal communication from their team. While the plane crew may be lovely, the service outside of this has been nothing short of dreadful, and if given the option, I will avoid flying with them in future.",3,29th December 2022
11,"✅ Trip Verified |  Vancouver to Delhi via London. We were booked to fly from Vancouver to New Delhi via London Heathrow on Dec 22nd. We received an email on Dec 20th informing us about the industrial action in the UK. I called to find out how it may impact our travel. The representative kind of scared us of being possibly stranded during our travel and offered us a full refund. We called again to confirm about other options but he did not offer any other solutions. We asked to cancel our tickets and he told us about the cancellation fee. We booked new tickets with another airline with double the cost as our trip was urgent (simultaneously). He told us he no longer can cancel our tickets on the system but promised us he will make it happen because he told us we would get a full refund. He processed the cancellation. 5 hours later he emailed us that the tickets couldn’t be cancelled and suggested we cancel our new tickets once he found out they were with another airline (we lost $1000 from cancelling the new tickets). Now, the representative claimed that he never said there won’t be any services available and asked us why we were worrying about the industrial action, and that other “arrangements” will be made if there were any issues (this was new information never given to us before). We kept our British Airway tickets. The next day, we asked to speak with the manager and report that we were misguided about the whole situation. We never heard back from the manager. As we logged in to check-in 15 hours before take off, we found that our VAN — LHR flight was cancelled (due to the bad weather in Vancouver). We did not receive any emails from the airport nor the airline about this change. We called BA again and asked about rearrangements for our flight, to which they offered rebooking with an additional $700-1000 per person price difference and the dates offered were about 7 days after our original flight was supposed to leave. Additionally, to cancel the rest of the flights with them which we could not reach since our first flight was cancelled, we had to pay about $1000 cancellation fee to get a refund. We were very frustrated with the overall experience and no accommodations nor accountability as they wanted to charge us for any service or changes possible. We were on the phone for 1.5 hours while other flights that we could have booked were getting sold out - the customer service person would take 15-20 minutes (for real) to search up each question or option we asked about. It has been a frustrating experience - we lost time and money and it ruined our holidays completely. We then demanded to speak to the manager, who again did not want to take any accountability for their team and gave us a small discount on the cancellation fee. In total, we were on the phone with them for 2 days back and forth, without any resolutions. We felt misguided and misinformed with their unfair policies towards their customers. We did not feel taken care of at all. We had to pay the price for the misinformation and the flights we did not cancel ourselves. After all this trouble, we spent Christmas without our family and the missed the urgent reasons we were travelling for. ",5,28th December 2022
12,"✅ Trip Verified |  Old A320 with narrow pitch. Flight perfectly on time, with constant announcements from cockpit. Friendly staff, free chips and water. Quick luggage delivery at T5.",1,24th December 2022
13,"✅ Trip Verified |  Another BA Shambles. Started off well with excellent check in at first at t5, mid afternoon so avoided the early morning, evening scrum. Into the Concorde lounge, excellent service again. Great choice of cocktails, wine etc. Food ok a bit overcooked but pretty reasonable. Called to the boarding gate. Chaos, people jostling for position to get on the plane. People with children under 5 called before the 8 people in first bankrolling the flight and most of them well over 5. We get on to be told that none of the lights in first can be dimmed at all, so the lights were on all night. It was like being detained and interrogated! Excellent wine and champagne selection. Dinner menu handed out. I’ll have the prawn cocktail to start please. No you won’t as they’ve only loaded one for 8 people and the guy in 1A got it. I bet he felt like he’d won the lottery. Ok I’ll have the beef wellington, basically a freezing slice of beef with some lettuce. Mains,  I’ll have the curry, no you won’t as they’ve substituted that with Christmas dinner.  I’m going to the Maldives to get away from Christmas. I ended up with short ribs that were inedible, no salad starter, no water offered, no bread roll. I just couldn’t eat it. So basically my husband and I have spent £20,000 on 2 return seats to be blinded by lights on and left starving. No apologies. Watch out BA as Virgin start flying direct in October. As always you rest on your laurels and treat your customers like idiots.",1,22nd December 2022
14,"Not Verified |  BA cancelled my flight home to Heathrow on Dec 19th. On the face of it, that was sensible as the weather in Iceland was appalling. However, what was not acceptable was that the flight was cancelled only 4 hours before take off time by which time I was already struggling through dreadful driving conditions to get to the airport. I got nowhere near before the conditions became too bad. If they had taken advice they would have spared everyone the need to try and travel on roads that all ended up closed. I am now booked onto the flight on the 21st and downgraded for my sins. Having checked today, as I type they have not cancelled the flight on the 20th despite the road to Keflavík being closed! Do they not check these things? Any help from BA offered - not really.",8,20th December 2022
15,"Not Verified |  BA cancelled my flight home, the last flight of the day into Heathrow, and tried to push me onto another flight to London City 3 hours later! My car was at Heathrow. I didn't want to try and cross London late at night on public transport with luggage, especially as there were rail strikes announced around that time. I had to book a flight home with Lufthansa which cost €500 for an economy seat, but at least it got me home to Heathrow (all be it another terminal) on the Friday night so I could get home to family. I still have had no news on a refund of the €500 2 months on. It's such a shame, flying BA used to be such a pleasurable experience. BA have cancelled or moved one leg of every journey we've booked this year. We are regrettably have to use other airlines now which have much better reliability and customer service.",3,19th December 2022
16,"✅ Trip Verified | Turned up 3.5 hours in advance, Terminal 5 at London Heathrow was already carnage, 100s of people trying to check in, only 5 desks manned. Long queues at security due to only 4 lines open. People stressed, pushing, shouting, and flight delayed by 2 hours, according to pilot delay due to suitcases all needing to be loaded. Missed connecting flight in Doha, 12 hours wait til next one. Received a voucher, approx £6 for the whole day. Arrived 1 day later, my suitcase didn’t arrive with me. Filed a claim at the desk, for 5 days no update, no information, no offer of compensation and no solution offer. I now have a spoilt holiday, many personal belongings are gone, xmas gifts missing, extensive expenses I don’t know if I will be reimbursed. Beware with BA, expect low level or zero customer service, old planes, and zero help if anything goes wrong or missing. I will personally avoid BA in future at all costs.",1,19th December 2022
17,"Not Verified |  Boarding – at gate at LGW they called Group 1 to board (we were World Traveller Plus & Group 3), then called ""anyone in Groups 2-6"", whereupon everyone else surged forward. Why have numbered boarding groups if you don’t use them. Cabin crew - Treated passengers as an inconvenience as they moved about the plane. At one point a passenger was coming out of the toilet as a crew member approached and the crew member just pushed the door closed pushing them back into the toilet as they went past, and without even a word. No acknowledgement when you stood aside to let them past. Service – We were in the final row of six in WT+ (which has a total of 48 seats). The lunch meal was brought out and we were the last people to be served (not unusual for back row seats) but when it came to us there was only the vegetarian option left of the 3 menu options. Cabin steward said that they had only been given 48 WT+ meals. There was a second hot meal served before we landed. Again, the same server got to us last and again there was only a vegetarian option left. I asked if it might not have been possible to commence serving this second meal from back to front so that we had a choice for at least one meal, and she said she hadn’t thought of that! Food – Some of it was inedible. Vegetarian Cannelloni had pasta so thick and uncooked neither of us could eat it. The bread roll was crispy like toast in the bottom half and soft in the top half. Only thing I could eat was the Baby Bel! In between meal snacks consisted of a 2 biscuit pack of shortbread, pretty basic. Drinks – They ran out of red wine 4 hours into an 11-hour flight. Toilets – There was no toilet accessible directly from the WT+ section. We had to walk halfway down the plane through Economy to reach a shared toilet. We flew Virgin Atlantic 2 months before in equivalent (Premium Economy) and it was so much better. Organised boarding, sparkling wine or orange on boarding (water or orange in BA), food options available (even in last row seats), better food, proper glasses/cups for drinks, dedicated toilet access, help yourself snacks, helpful service from cabin crew. We will not be looking to fly BA over Virgin in future.",1,19th December 2022
18,"✅ Trip Verified |  Missing baggage customer service was the worst I’ve ever experienced. I arrived back in Phoenix on Sunday evening and air tags showed my bags arrived on Monday, but it took three more days before they were finally delivered. I understood that due to delays caused by freezing fog in London my luggage did not make it onto my final flight. I filled out the required form at the Phoenix airport and then attempted to fill one out online where I received a message saying that the bags had already been reported missing and to enter the tracking code that had been sent to me via email, but no email was received. I made phone calls daily and was told a message was sent and I should hear back within 24 hours. Finally the email with the tracking number was received on Tuesday night. I went online with the tracking number on Wednesday and it requested that I provide the same information that I had given them on the form at the airport. My luggage was finally delivered on Thursday afternoon. ",2,17th December 2022
19,"✅ Trip Verified |  British Airways are not the flag carrier they used to be. The check-in staff at the Club Europe area did not display any premium service and did not provide a good overall service.  The Galleries South Lounge was very busy, but the food was very good. There is a good array of salads, pasta, bread, and hot food available. The festive Turkey and Ham pie was particularly good. The flight was delayed as LHR was very busy on a Tuesday evening. The boarding process was stressful due to the lack of any queue management system and the majority of passengers congregating around the gate. Despite BA using a group system to board, it took almost 1hr to board 240 passengers. The flight itself was good, with a good Club meal service. The bar service was good but it seems that BA have done away with champagne on-board and also in the lounge. A menu is handed out prior to departure with a good food offering for the length of flight. The food was very good, with beef cheek served with vegetables being chosen. BA have always excelled with their catering and this has not changed. The seat is a standard economy seat, with a table in the middle seat for Club Europe, a standard practice for BA. The seat was comfortable, but with limited leg room. The cabin was clean, presentable, and tidy with no issues. The A321 featured Wi-Fi which contains a very good landing page with flight information, access to the Speedbird Cafe menu, access to BA.com, and a good pricing strategy for wither just messaging or streaming also. Overall, the airline is still a good world player, but with clear improvements needed with their ground staff. The cabin manager was very good, but the other crew in Club did not display the expected behaviours in business class. She kept touching her face, not making eye contact with passengers, and seemed uninterested and like she did not want to be there.",2,14th December 2022
20,"✅ Trip Verified |  Stupidly tried BA again after a five year gap and paid over £7000 for my wife and I to go to Barbados because I thought the new Business Class layout might rival Virgin Atlantic on the route. About six months ago BA announced they were switching planes to the old antique push-me-pull-you layout but it was too late to reorganise our holiday logistics. Sure enough we suffered the most appallingly uncomfortable flights with no room (eight seats across), worn out fittings, inedible food and surly FAs.",5,12th December 2022
21,Not Verified |  Seat horribly narrow; 3-4-3 on a 777. Thankfully the flight was only a quarter full so was able to stretch out. Food and beverage service was good and it was great having a proper beer not a cup of froth that overflows! Cabin crew very good. Booked as a BA ticket that included travel on Qatar Airways as well.,6,12th December 2022
