,reviews,stars,date
90,"Not Verified |  Decent flight and airplane, non existing customer service for refunds and support after delayed flight. Flight on 18th June-2022 from Vancouver to London airport was delayed for roughly 4 hours. We received a 10 CAD voucher for some drinks, this was appreciated. Because of this delay we missed our connecting flight to Amsterdam (from London), within the airplane we have been informed to go towards the British airway information desk to reschedule another flight towards Amsterdam. When we left the airplane in London, there where 3 employees working and a 400 people waiting line. We asked around towards the nice employees British airways have and we have been told this was the only line/desks to get a reschedule for our flight to Amsterdam, so we had to wait and be patient. After 4 hours of waiting and being roughly halfway the line we felt like uninformed cattle in an 4h waiting line with only candy bars and sugar cookies to eat.  At some point after 4 hours they were giving away hotel vouchers and shuttle bus vouchers because we couldn’t sleep/stay at the airport, as we noticed on the website we have been assigned another flight. This flight was about to leave Tuesday morning (it was Sunday 5pm when we arrived in London). This meant we have to spent 2 additional days in London before we were able to fly to the Netherlands. We have been told by the employees we could arrange our own transfer back to the Netherlands and save the receipts, and we will get a refund on the costs (hotel, food, transport) and a refund on the flight for Tuesday as we where not going to take this flight. They released out baggage, gave us a hotel voucher and cancelled the Tuesday flight they gave us. We were going to make our own travel back to the Netherlands. Seems British Airways claims & refund process is non responsive, as we already requested information 2 times for our compensation, but received nothing yet. apart from an automated email saying we could get a small refund based on our missed flight. ",1,20th July 2022
91,Not Verified |  Reasonably smooth boarding. Meal service was smooth ad efficient but no ice or spirits available as no room on the trolley - could they have offered to serve this afterwards? Seat was very uncomfortable indeed on this aircraft so got little if any sleep on the long overnight flight. Cabin crew spent much of the time between meals talking loudly at the rear galley meaning we couldn't sleep even if the seats were comfortable. This was so disrespectful and inconsiderate.,8,18th July 2022
92,"✅ Trip Verified |  Three flights, London to Reykjavik return and Frankfurt to London. Generally the flights were of an acceptable standard, though the seats and legroom are quite tight for a three-hour flight. The cabin crews were efficient and generally friendly. A big plus for BA was informative announcements from the cockpit, often missing on other airlines. Flights operated generally close to the advertised times. But BA was let down by chaotic check-in and boarding procedures. In preparation for each flight the number of check-in staff was one or at most two (in Frankfurt the lone check-in agent was also checking in Business Class passengers). Why are Economy class passengers boarded from the front and not from the back? This was standard across the three flights, but slowed down the boarding process immensely as people seated further back tried to get past forward seated passengers stowing their (enormous) cabin baggage. It would make much more sense to board people at the back first. And to enforce baggage rules so that cabin crew are not wandering up and down the cabin trying to find overhead space for the hapless passengers who boarded last. The small bottle of water and a half-full bag of crisps offered as a snack on a three-hour flight to Iceland was just tokenism and compared badly with what Air France offered on a subsequent short flight to Paris. At Reykjavik there was no departure lounge next to the gate -- passengers had to queue wherever they could in the corridor.",1,18th July 2022
93,✅ Trip Verified | Routine typical BA domestic shuttle flight. Nothing special. Departure five minutes early but no one to greet flight upon arrival hence a 30 minute delay. Crew were attentive and charming. Usual clean cut BA product that when it works well is fine.,1,17th July 2022
94,"✅ Trip Verified |  Over 1 week ago I cancelled 2 Club Europe flights due to testing positive for Covid the day before. They were booked many months ago and eligible for the Travel Voucher, so I opted for this online. Since then, absolute silence and BA pages state it might take up to a week (previous vouchers have been received within a few hours of cancellation). As a very loyal BA customer for more than 40 years, I am appalled at the absolute state of chaos that the airline now portrays. With a further 6 bookings with BA planned for the rest of 2022, I have to admit that travelling with them (ex LHR) has now become an absolute nightmare.",2,13th July 2022
95,Not Verified |  Flight delayed slightly due to luggage conveyor breaking down. Luggage never made it to Toronto and we filed a lost baggage report. Within 24 hours our luggage arrived in Toronto and a wonderful BA representative went down into the baggage loading area to retrieve it for me. Would definitely give BA a 5 star rating and have them again.,2,12th July 2022
96,"✅ Trip Verified |  Check in and security at LHR efficient. Went to Galleries North which was busy but fine with good service. Left from B gates. Efficient boarding with welcome drinks and menus. This was my first time on the club suite. Travelling with 2 children. BA moved our seated but we were all seated near to each other and they apologised for this at check in. It was a full flight in all cabins so staff busy. I liked the new suite which felt superior to the old club world product. The entertainment was excellent and the screen large and well positioned. The menu was quite limited but the quality was reasonable. Prior to COVID one could pre order mains in club which might be worth bringing back. As it happened we all ordered and were able to have the beef dish but I doubt my children would have liked the vegetarian korma had they run out. The club kitchen ran out of food quite quickly. It was a long flight so this was not surprising but my children were quite hungry as a result. Part of this was the result of other passengers from other cabins taking food from it. The second meal was fine and the cabin service director did source an alternative meal for my children from economy which I thought was quite good. On time arrival, prompt disembarkation and bags off quickly. We don’t tend to have a good track record with bag delivery so this was a pleasant surprise. Overall a good flight.",8,9th July 2022
97,"✅ Trip Verified | Washington to London. Our flight was unexpectedly cancelled. My husband spent hours on the phone in the middle of the night to try and rebook our flight. We were told by the customer service representative that we should just cancel our trip (after spending thousands in lodging, tickets, tours, etc). When we finally rebooked we still lost one day, one day of lodging, and tickets to a show. We tried to at least get another day on the end of our trip but no one could help us. No one cared that our family vacation was totally altered and cost us a bunch of money. We are so disappointed and angry with the customer service here!",1,7th July 2022
98,"Not Verified | Nairobi to New York via London. British Airways has given me such grief, trying to cancel a ticket for my uncle who passed away, they canceled a ticket instead for my newly widowed aunt after they split her booking off the original booking. It is now less than two weeks until her scheduled flight, and I have been trying to amend her booking and hours and hours I have spent on hold, or with an agent, being told that my query has been prioritized and that I will receive a call back within 48 hours. I call every 2-3 days and nothing has been done to reinstate her ticket and no agent can ever resolve the situation. I will never book with BA again. Sure, flying with them is easy, but their total lack of practical assistance has caused distress and frustration and so many hours of wasted time. And to think I spent more money on a ticket with BA than other cheaper carriers thinking it would make my life easier. BIG MISTAKE",1,6th July 2022
99,"Not Verified |  Today, my husband and a friend flew from Dublin to London City Airport. All apparently went well from check-in through the flight. After that, the ineptitude and lack of systems seemed to be in full bloom. We waited and waited for our bags to come off the baggage carriage, but neither my husband's nor mine came. I found a BA service person to ""help"" me. He told me that there were 60 bags checked and 59 on the plane.  I thought, one of our bags made it. Then, two other customers from the same flight were complaining to someone else that they, too, had not gotten their bags. So, I assumed the 59 out of 60 was some kind of interesting fiction. I was then told to file a claim on BA.com which we did. At this time, about 10 hours after our flight landed, the system says they have no idea where our bags are! Now, I've had bags not get on flights before - less and less as airlines have tracked their bags fastidiously (I usually fly United Airlines which tracks your bag at every stage of the flight with updated info - e.g., ""Your bag was loaded onto the plane""; ""Your bag is on its way to baggage claim""). BA doesn't seem to have anything like this. In this case, again, it appears BA cannot even locate the bag. I hadn't flown BA in many years and with experience I would never book them again.",5,6th July 2022
